,author,title,description,url,urlToImage,publishedAt,content,source.id,source.name
0,https://www.facebook.com/bbcnews,Niger: At least 69 killed in gun attack,At least 69 people were killed when they were ambushed by suspected Islamist militants.,https://www.bbc.co.uk/news/world-africa-59172655,https://ichef.bbci.co.uk/news/1024/branded_news/E7A8/production/_121440395_mediaitem121440391.jpg,2021-11-05T02:35:25Z,"Image source, AFP via Getty Images
Image caption, Niger is facing jihadist insurgencies on its borders with Mali, Burkina Faso and Nigeria (file picture)
Niger has declared two days of national mou… [+1124 chars]",bbc-news,BBC News
1,https://www.facebook.com/bbcnews,Kevin Strickland: Fundraiser for exonerated Missouri man tops $1.5m,Kevin Strickland was released after 42 years in jail over a triple murder he did not commit.,https://www.bbc.co.uk/news/world-us-canada-59452651,https://ichef.bbci.co.uk/news/1024/branded_news/173AB/production/_121774159_screenshot-36.png,2021-11-28T15:47:00Z,"Image source, Midwest Innocence Project
Image caption, Kevin Strickland was sentenced in June 1979
A fundraiser set up to help a Missouri man who served more than 42 years in jail for a triple murd… [+2705 chars]",bbc-news,BBC News
2,https://www.facebook.com/bbcnews,Kevin Strickland exonerated after 42 years in Missouri prison,Kevin Strickland was arrested at age 18 and convicted of a triple murder he did not commit.,https://www.bbc.co.uk/news/world-us-canada-59396598,https://ichef.bbci.co.uk/news/1024/branded_news/173AB/production/_121774159_screenshot-36.png,2021-11-23T22:17:06Z,"Image source, Midwest Innocence Project
Image caption, 
A Missouri man wrongfully convicted of a triple murder in 1978 and imprisoned for more than 42 years has been exonerated and released.
Kevin… [+3602 chars]",bbc-news,BBC News
